[I 2026-02-28 00:18:21,975] Trial 69 finished with value: 0.48643271875044625 and parameters: {'lr': 0.006808724145147228, 'weight_decay': 1.6477559444221458e-08, 'bspline_cap_quantile': 0.9930954388790373, 'bspline_positive_overflow': 'clip_to_cap'}. Best is trial 36 with value: 0.47214535359248694.
[I 2026-02-28 00:22:50,364] Trial 70 finished with value: 0.4732721525569298 and parameters: {'lr': 0.002789490381958338, 'weight_decay': 2.7381321554848398e-08, 'bspline_cap_quantile': 0.9822833301989686, 'bspline_positive_overflow': 'clip_to_cap'}. Best is trial 36 with value: 0.47214535359248694.
[I 2026-02-28 00:27:16,760] Trial 71 finished with value: 0.47221548940200375 and parameters: {'lr': 0.00195872326128879, 'weight_decay': 4.882661078307453e-08, 'bspline_cap_quantile': 0.9878171508147232, 'bspline_positive_overflow': 'clip_to_cap'}. Best is trial 36 with value: 0.47214535359248694.
[I 2026-02-28 00:31:40,958] Trial 72 finished with value: 0.4725181734554797 and parameters: {'lr': 0.0012514023907104778, 'weight_decay': 4.450593135555354e-08, 'bspline_cap_quantile': 0.9842583554019253, 'bspline_positive_overflow': 'clip_to_cap'}. Best is trial 36 with value: 0.47214535359248694.
[I 2026-02-28 00:36:07,776] Trial 73 finished with value: 0.4722638736152691 and parameters: {'lr': 0.0018566964031915695, 'weight_decay': 1.2904774447729552e-08, 'bspline_cap_quantile': 0.974329079366903, 'bspline_positive_overflow': 'clip_to_cap'}. Best is trial 36 with value: 0.47214535359248694.
[I 2026-02-28 00:40:32,556] Trial 74 finished with value: 0.4721497058526036 and parameters: {'lr': 0.0015673149260869, 'weight_decay': 2.3226591097987017e-08, 'bspline_cap_quantile': 0.9884600533386184, 'bspline_positive_overflow': 'clip_to_cap'}. Best is trial 36 with value: 0.47214535359248694.
[I 2026-02-28 00:44:59,318] Trial 75 finished with value: 0.47260994904378634 and parameters: {'lr': 0.002333345705767422, 'weight_decay': 2.025712101538212e-08, 'bspline_cap_quantile': 0.9880940829108689, 'bspline_positive_overflow': 'clip_to_cap'}. Best is trial 36 with value: 0.47214535359248694.
[I 2026-02-28 00:49:26,757] Trial 76 finished with value: 0.4725579108375375 and parameters: {'lr': 0.0012085472178617132, 'weight_decay': 2.4725975811206297e-08, 'bspline_cap_quantile': 0.9848759832386611, 'bspline_positive_overflow': 'clip_to_cap'}. Best is trial 36 with value: 0.47214535359248694.
[I 2026-02-28 00:53:50,053] Trial 77 finished with value: 0.4731157459712325 and parameters: {'lr': 0.0016913251985297207, 'weight_decay': 3.563453376576484e-08, 'bspline_cap_quantile': 0.989133187324118, 'bspline_positive_overflow': 'large_token'}. Best is trial 36 with value: 0.47214535359248694.
[I 2026-02-28 00:58:16,600] Trial 78 finished with value: 0.4743042528212353 and parameters: {'lr': 0.003409819425973796, 'weight_decay': 5.870207628461014e-06, 'bspline_cap_quantile': 0.9906022268943371, 'bspline_positive_overflow': 'clip_to_cap'}. Best is trial 36 with value: 0.47214535359248694.
[I 2026-02-28 01:02:43,249] Trial 79 finished with value: 0.47280547388423466 and parameters: {'lr': 0.002534236786606614, 'weight_decay': 1.4043082547203255e-08, 'bspline_cap_quantile': 0.9862291579495841, 'bspline_positive_overflow': 'clip_to_cap'}. Best is trial 36 with value: 0.47214535359248694.
[I 2026-02-28 01:07:06,974] Trial 80 finished with value: 0.4723060564392202 and parameters: {'lr': 0.001545673932479964, 'weight_decay': 1.2128473000142952e-07, 'bspline_cap_quantile': 0.9833151849613768, 'bspline_positive_overflow': 'clip_to_cap'}. Best is trial 36 with value: 0.47214535359248694.
[I 2026-02-28 01:11:31,181] Trial 81 finished with value: 0.47228183727683415 and parameters: {'lr': 0.0014066991849230384, 'weight_decay': 2.2799613013278302e-07, 'bspline_cap_quantile': 0.9962898656875531, 'bspline_positive_overflow': 'clip_to_cap'}. Best is trial 36 with value: 0.47214535359248694.
[I 2026-02-28 01:15:58,223] Trial 82 finished with value: 0.4722647617444494 and parameters: {'lr': 0.0019519124918436226, 'weight_decay': 5.3323876821500385e-08, 'bspline_cap_quantile': 0.9936590249224452, 'bspline_positive_overflow': 'clip_to_cap'}. Best is trial 36 with value: 0.47214535359248694.
[I 2026-02-28 01:20:21,900] Trial 83 finished with value: 0.47213382806188986 and parameters: {'lr': 0.0017100725536204407, 'weight_decay': 3.390012921969734e-08, 'bspline_cap_quantile': 0.9923644577727242, 'bspline_positive_overflow': 'clip_to_cap'}. Best is trial 83 with value: 0.47213382806188986.
[I 2026-02-28 01:24:45,793] Trial 84 finished with value: 0.47243068862681836 and parameters: {'lr': 0.002148599957057916, 'weight_decay': 1.0109559183495994e-08, 'bspline_cap_quantile': 0.9918758041369589, 'bspline_positive_overflow': 'clip_to_cap'}. Best is trial 83 with value: 0.47213382806188986.
[I 2026-02-28 01:29:12,708] Trial 85 finished with value: 0.4731236393845514 and parameters: {'lr': 0.000914650026896563, 'weight_decay': 2.9516492121752005e-08, 'bspline_cap_quantile': 0.9879253123005755, 'bspline_positive_overflow': 'clip_to_cap'}. Best is trial 83 with value: 0.47213382806188986.
[I 2026-02-28 01:33:36,896] Trial 86 finished with value: 0.4723277253642781 and parameters: {'lr': 0.0016964607167614812, 'weight_decay': 2.1622237441817325e-08, 'bspline_cap_quantile': 0.9978386960836335, 'bspline_positive_overflow': 'clip_to_cap'}. Best is trial 83 with value: 0.47213382806188986.
[I 2026-02-28 01:38:01,131] Trial 87 finished with value: 0.4727067792196234 and parameters: {'lr': 0.001071022846144032, 'weight_decay': 4.209911369424062e-08, 'bspline_cap_quantile': 0.9899995279586233, 'bspline_positive_overflow': 'clip_to_cap'}. Best is trial 83 with value: 0.47213382806188986.
[I 2026-02-28 01:42:30,042] Trial 88 finished with value: 0.477997152410002 and parameters: {'lr': 0.0012419236574768165, 'weight_decay': 0.0002615192281169751, 'bspline_cap_quantile': 0.9927213939807064, 'bspline_positive_overflow': 'large_token'}. Best is trial 83 with value: 0.47213382806188986.
[I 2026-02-28 01:46:52,985] Trial 89 finished with value: 0.47333877610883685 and parameters: {'lr': 0.002826947257945922, 'weight_decay': 1.5289902460561822e-08, 'bspline_cap_quantile': 0.9961252920287941, 'bspline_positive_overflow': 'clip_to_cap'}. Best is trial 83 with value: 0.47213382806188986.
[I 2026-02-28 01:51:19,350] Trial 90 finished with value: 0.47210773192759703 and parameters: {'lr': 0.001814406340941725, 'weight_decay': 1.1298766673214055e-07, 'bspline_cap_quantile': 0.9910423377963541, 'bspline_positive_overflow': 'clip_to_cap'}. Best is trial 90 with value: 0.47210773192759703.
[I 2026-02-28 01:55:42,378] Trial 91 finished with value: 0.47213190407091593 and parameters: {'lr': 0.001818306203254146, 'weight_decay': 1.0991528600468288e-07, 'bspline_cap_quantile': 0.9908565634053238, 'bspline_positive_overflow': 'clip_to_cap'}. Best is trial 90 with value: 0.47210773192759703.
[I 2026-02-28 02:00:06,158] Trial 92 finished with value: 0.4725413191964764 and parameters: {'lr': 0.0021747161063814606, 'weight_decay': 1.212642776147215e-07, 'bspline_cap_quantile': 0.9605138742990588, 'bspline_positive_overflow': 'clip_to_cap'}. Best is trial 90 with value: 0.47210773192759703.
[I 2026-02-28 02:05:15,644] Trial 93 finished with value: 0.5022512903289864 and parameters: {'lr': 0.0025715075070046876, 'weight_decay': 0.009053038190066764, 'bspline_cap_quantile': 0.989240450311561, 'bspline_positive_overflow': 'clip_to_cap'}. Best is trial 90 with value: 0.47210773192759703.
[I 2026-02-28 02:09:38,069] Trial 94 finished with value: 0.4721098445142546 and parameters: {'lr': 0.0016173497064319467, 'weight_decay': 6.964810181255276e-08, 'bspline_cap_quantile': 0.9908228664511611, 'bspline_positive_overflow': 'clip_to_cap'}. Best is trial 90 with value: 0.47210773192759703.
[I 2026-02-28 02:14:03,181] Trial 95 finished with value: 0.4721398269347339 and parameters: {'lr': 0.0015803885418299978, 'weight_decay': 8.97201846029753e-08, 'bspline_cap_quantile': 0.9925873297972472, 'bspline_positive_overflow': 'clip_to_cap'}. Best is trial 90 with value: 0.47210773192759703.
[I 2026-02-28 02:18:28,509] Trial 96 finished with value: 0.4721405462427427 and parameters: {'lr': 0.0015424693176758857, 'weight_decay': 2.413871211042152e-07, 'bspline_cap_quantile': 0.9923680508948981, 'bspline_positive_overflow': 'clip_to_cap'}. Best is trial 90 with value: 0.47210773192759703.
[I 2026-02-28 02:22:53,918] Trial 97 finished with value: 0.47211105822241656 and parameters: {'lr': 0.0016626695646976026, 'weight_decay': 1.66140454075364e-07, 'bspline_cap_quantile': 0.9927995432270732, 'bspline_positive_overflow': 'clip_to_cap'}. Best is trial 90 with value: 0.47210773192759703.
[I 2026-02-28 02:27:19,664] Trial 98 finished with value: 0.4725042433287998 and parameters: {'lr': 0.0013386127166219418, 'weight_decay': 1.162552271691267e-06, 'bspline_cap_quantile': 0.967064088047906, 'bspline_positive_overflow': 'clip_to_cap'}. Best is trial 90 with value: 0.47210773192759703.
[I 2026-02-28 02:31:44,403] Trial 99 finished with value: 0.47213561317584624 and parameters: {'lr': 0.0016091975112358234, 'weight_decay': 3.953412542704508e-07, 'bspline_cap_quantile': 0.994255997122477, 'bspline_positive_overflow': 'clip_to_cap'}. Best is trial 90 with value: 0.47210773192759703.
RESULT bspline_integer_basis tuned_column=I6 best_trial_val_logloss= 0.472108 final_val_logloss= 0.472108 final_test_logloss= 0.467324
