/home/alex/git/intfeat/.venv/lib/python3.12/site-packages/joblib/_multiprocessing_helpers.py:44: UserWarning: [Errno 13] Permission denied.  joblib will operate in serial mode
  warnings.warn("%s.  joblib will operate in serial mode" % (e,))
Loaded rows [0, 400000) in 7.7s
Loaded rows [400000, 800000) in 8.5s
Loaded rows [800000, 1200000) in 9.4s
[I 2026-02-27 10:17:01,565] A new study created in RDB with name: bspline_i6_tune_capq_overflow_400k_100t
B-spline per-column Optuna: variant=bspline_integer_basis bspline_config=experiments/criteo_fwfm/config/model_bspline_quantile_large_token.yaml tuned_column=I6 completed_before=0 target=100 remaining=100
/home/alex/git/intfeat/.venv/lib/python3.12/site-packages/torch/cuda/__init__.py:182: UserWarning: CUDA initialization: The NVIDIA driver on your system is too old (found version 11040). Please update your GPU driver by downloading and installing a new version from the URL: http://www.nvidia.com/Download/index.aspx Alternatively, go to: https://pytorch.org to install a PyTorch version that has been compiled with your version of the CUDA driver. (Triggered internally at /pytorch/c10/cuda/CUDAFunctions.cpp:109.)
  return torch._C._cuda_getDeviceCount() > 0
[I 2026-02-27 10:21:41,765] Trial 0 finished with value: 0.49892835165618465 and parameters: {'lr': 0.0005611516415334506, 'weight_decay': 0.005061576888752304, 'bspline_cap_quantile': 0.9862337001196646, 'bspline_positive_overflow': 'large_token'}. Best is trial 0 with value: 0.49892835165618465.
[I 2026-02-27 10:26:27,680] Trial 1 finished with value: 0.48278880385099937 and parameters: {'lr': 0.00020511104188433984, 'weight_decay': 2.2310108018679158e-08, 'bspline_cap_quantile': 0.9928757192158594, 'bspline_positive_overflow': 'clip_to_cap'}. Best is trial 1 with value: 0.48278880385099937.
[I 2026-02-27 10:31:39,266] Trial 2 finished with value: 0.5259093786396863 and parameters: {'lr': 0.00010994335574766199, 'weight_decay': 0.006598711072054081, 'bspline_cap_quantile': 0.9912059107196209, 'bspline_positive_overflow': 'large_token'}. Best is trial 1 with value: 0.48278880385099937.
[I 2026-02-27 10:37:27,697] Trial 3 finished with value: 0.4826916935234921 and parameters: {'lr': 0.00023270677083837802, 'weight_decay': 6.690421166498788e-07, 'bspline_cap_quantile': 0.9759754433657958, 'bspline_positive_overflow': 'large_token'}. Best is trial 3 with value: 0.4826916935234921.
[I 2026-02-27 10:43:01,499] Trial 4 finished with value: 0.4724798021701695 and parameters: {'lr': 0.0016738085788752138, 'weight_decay': 6.870101665590006e-08, 'bspline_cap_quantile': 0.9644611601024933, 'bspline_positive_overflow': 'clip_to_cap'}. Best is trial 4 with value: 0.4724798021701695.
[I 2026-02-27 10:48:46,171] Trial 5 finished with value: 0.4756223827959146 and parameters: {'lr': 0.0037183641805732083, 'weight_decay': 1.577766363058244e-07, 'bspline_cap_quantile': 0.9754546047014738, 'bspline_positive_overflow': 'large_token'}. Best is trial 4 with value: 0.4724798021701695.
[I 2026-02-27 11:09:29,017] Trial 6 finished with value: 0.47246785342351477 and parameters: {'lr': 0.0016409286730647919, 'weight_decay': 1.0547383621352015e-07, 'bspline_cap_quantile': 0.9532200538527713, 'bspline_positive_overflow': 'clip_to_cap'}. Best is trial 6 with value: 0.47246785342351477.
[I 2026-02-27 11:30:28,491] Trial 7 finished with value: 0.4767305563580812 and parameters: {'lr': 0.004138040112561018, 'weight_decay': 6.724850206557239e-07, 'bspline_cap_quantile': 0.9548347696433159, 'bspline_positive_overflow': 'large_token'}. Best is trial 6 with value: 0.47246785342351477.
[I 2026-02-27 11:49:22,802] Trial 8 finished with value: 0.48928979986411 and parameters: {'lr': 0.00017541893487450815, 'weight_decay': 9.355380606452179e-06, 'bspline_cap_quantile': 0.9517022317952033, 'bspline_positive_overflow': 'large_token'}. Best is trial 6 with value: 0.47246785342351477.
[I 2026-02-27 12:08:13,579] Trial 9 finished with value: 0.4733299846240172 and parameters: {'lr': 0.0021137059440645744, 'weight_decay': 7.417652034871823e-07, 'bspline_cap_quantile': 0.9757433670483017, 'bspline_positive_overflow': 'large_token'}. Best is trial 6 with value: 0.47246785342351477.
[I 2026-02-27 12:31:52,881] Trial 10 finished with value: 0.4841810682444178 and parameters: {'lr': 0.00812888872446563, 'weight_decay': 0.0001582158757719091, 'bspline_cap_quantile': 0.9625418114599122, 'bspline_positive_overflow': 'clip_to_cap'}. Best is trial 6 with value: 0.47246785342351477.
[I 2026-02-27 12:50:20,816] Trial 11 finished with value: 0.4735120428009788 and parameters: {'lr': 0.0008099479024032742, 'weight_decay': 1.7074626001153678e-08, 'bspline_cap_quantile': 0.9634226178731903, 'bspline_positive_overflow': 'clip_to_cap'}. Best is trial 6 with value: 0.47246785342351477.
[I 2026-02-27 13:08:51,269] Trial 12 finished with value: 0.4727911754143835 and parameters: {'lr': 0.0013838713864867114, 'weight_decay': 1.4439505894609514e-05, 'bspline_cap_quantile': 0.9629441683037198, 'bspline_positive_overflow': 'clip_to_cap'}. Best is trial 6 with value: 0.47246785342351477.
[I 2026-02-27 13:27:21,608] Trial 13 finished with value: 0.4747369203859907 and parameters: {'lr': 0.0005446437170542572, 'weight_decay': 1.03888306314208e-07, 'bspline_cap_quantile': 0.95700738374344, 'bspline_positive_overflow': 'clip_to_cap'}. Best is trial 6 with value: 0.47246785342351477.
[I 2026-02-27 13:45:55,173] Trial 14 finished with value: 0.4725543821459047 and parameters: {'lr': 0.0018182389828411837, 'weight_decay': 6.93857500068452e-06, 'bspline_cap_quantile': 0.9686420619171286, 'bspline_positive_overflow': 'clip_to_cap'}. Best is trial 6 with value: 0.47246785342351477.
[I 2026-02-27 14:04:39,439] Trial 15 finished with value: 0.4756394463210051 and parameters: {'lr': 0.003714851436138144, 'weight_decay': 1.2091451698813886e-08, 'bspline_cap_quantile': 0.9511068825901229, 'bspline_positive_overflow': 'clip_to_cap'}. Best is trial 6 with value: 0.47246785342351477.
[I 2026-02-27 14:23:13,933] Trial 16 finished with value: 0.47293194337496147 and parameters: {'lr': 0.001007855359537672, 'weight_decay': 1.277114584588145e-07, 'bspline_cap_quantile': 0.9696681068103596, 'bspline_positive_overflow': 'clip_to_cap'}. Best is trial 6 with value: 0.47246785342351477.
[I 2026-02-27 14:41:54,007] Trial 17 finished with value: 0.484565658192056 and parameters: {'lr': 0.008607419445086138, 'weight_decay': 9.228568746299903e-05, 'bspline_cap_quantile': 0.9577400017822221, 'bspline_positive_overflow': 'clip_to_cap'}. Best is trial 6 with value: 0.47246785342351477.
[I 2026-02-27 15:00:30,538] Trial 18 finished with value: 0.47246358206938205 and parameters: {'lr': 0.00241318450549691, 'weight_decay': 2.359027673310921e-06, 'bspline_cap_quantile': 0.9840673608415349, 'bspline_positive_overflow': 'clip_to_cap'}. Best is trial 18 with value: 0.47246358206938205.
[I 2026-02-27 15:26:59,515] Trial 19 finished with value: 0.47330368063712186 and parameters: {'lr': 0.002881838632933024, 'weight_decay': 2.8501715055739204e-06, 'bspline_cap_quantile': 0.9986176701941394, 'bspline_positive_overflow': 'clip_to_cap'}. Best is trial 18 with value: 0.47246358206938205.
[I 2026-02-27 15:45:15,588] Trial 20 finished with value: 0.47847902960150457 and parameters: {'lr': 0.0052305809388557365, 'weight_decay': 6.01456035420063e-05, 'bspline_cap_quantile': 0.981403931368454, 'bspline_positive_overflow': 'clip_to_cap'}. Best is trial 18 with value: 0.47246358206938205.
[I 2026-02-27 16:03:28,742] Trial 21 finished with value: 0.472317335053947 and parameters: {'lr': 0.0015477540389569075, 'weight_decay': 5.020411180584235e-08, 'bspline_cap_quantile': 0.9827576256235563, 'bspline_positive_overflow': 'clip_to_cap'}. Best is trial 21 with value: 0.472317335053947.
[I 2026-02-27 16:21:47,646] Trial 22 finished with value: 0.4726888134402207 and parameters: {'lr': 0.0011182627933354601, 'weight_decay': 1.6140040135815563e-06, 'bspline_cap_quantile': 0.98318061845837, 'bspline_positive_overflow': 'clip_to_cap'}. Best is trial 21 with value: 0.472317335053947.
[I 2026-02-27 16:39:55,139] Trial 23 finished with value: 0.4724160317260033 and parameters: {'lr': 0.0023699191455650204, 'weight_decay': 2.7228975550807177e-07, 'bspline_cap_quantile': 0.980652499590853, 'bspline_positive_overflow': 'clip_to_cap'}. Best is trial 21 with value: 0.472317335053947.
[I 2026-02-27 16:58:04,313] Trial 24 finished with value: 0.4744892674275671 and parameters: {'lr': 0.0005848561944361282, 'weight_decay': 3.1766881674537613e-07, 'bspline_cap_quantile': 0.9802847408168056, 'bspline_positive_overflow': 'clip_to_cap'}. Best is trial 21 with value: 0.472317335053947.
[I 2026-02-27 17:16:12,968] Trial 25 finished with value: 0.47289545149742435 and parameters: {'lr': 0.0024942003243123667, 'weight_decay': 4.603042464037018e-08, 'bspline_cap_quantile': 0.9884033318594565, 'bspline_positive_overflow': 'clip_to_cap'}. Best is trial 21 with value: 0.472317335053947.
[I 2026-02-27 17:34:23,116] Trial 26 finished with value: 0.4796499348182872 and parameters: {'lr': 0.005511324751284091, 'weight_decay': 2.5982185124357724e-06, 'bspline_cap_quantile': 0.9788371997223715, 'bspline_positive_overflow': 'clip_to_cap'}. Best is trial 21 with value: 0.472317335053947.
[I 2026-02-27 17:54:26,020] Trial 27 finished with value: 0.4727422970231158 and parameters: {'lr': 0.0025606588342452982, 'weight_decay': 3.1308491749719785e-07, 'bspline_cap_quantile': 0.9844188261401128, 'bspline_positive_overflow': 'clip_to_cap'}. Best is trial 21 with value: 0.472317335053947.
[I 2026-02-27 18:22:19,158] Trial 28 finished with value: 0.48309677799649603 and parameters: {'lr': 0.0003866077596728798, 'weight_decay': 0.0005959455365104812, 'bspline_cap_quantile': 0.9712571397953872, 'bspline_positive_overflow': 'clip_to_cap'}. Best is trial 21 with value: 0.472317335053947.
[I 2026-02-27 18:47:30,961] Trial 29 finished with value: 0.47415252533281493 and parameters: {'lr': 0.0007849942384401773, 'weight_decay': 2.983212097678601e-05, 'bspline_cap_quantile': 0.9859738110022513, 'bspline_positive_overflow': 'clip_to_cap'}. Best is trial 21 with value: 0.472317335053947.
[I 2026-02-27 19:12:55,335] Trial 30 finished with value: 0.47243712884613576 and parameters: {'lr': 0.0012408863600863026, 'weight_decay': 3.308912686244358e-08, 'bspline_cap_quantile': 0.9965735665679933, 'bspline_positive_overflow': 'clip_to_cap'}. Best is trial 21 with value: 0.472317335053947.
[I 2026-02-27 19:33:58,921] Trial 31 finished with value: 0.4723522748508437 and parameters: {'lr': 0.0013308125518130814, 'weight_decay': 3.471460066198716e-08, 'bspline_cap_quantile': 0.9992391937117813, 'bspline_positive_overflow': 'clip_to_cap'}. Best is trial 21 with value: 0.472317335053947.
[I 2026-02-27 20:02:49,861] Trial 32 finished with value: 0.4725439215556957 and parameters: {'lr': 0.001156684468190106, 'weight_decay': 3.3828886018542856e-08, 'bspline_cap_quantile': 0.9973614519712888, 'bspline_positive_overflow': 'clip_to_cap'}. Best is trial 21 with value: 0.472317335053947.
[I 2026-02-27 20:26:00,935] Trial 33 finished with value: 0.4722994188572313 and parameters: {'lr': 0.0013765475393079701, 'weight_decay': 1.0301703272074854e-08, 'bspline_cap_quantile': 0.9937667377121029, 'bspline_positive_overflow': 'clip_to_cap'}. Best is trial 33 with value: 0.4722994188572313.
[I 2026-02-27 20:41:22,021] Trial 34 finished with value: 0.47341705720091193 and parameters: {'lr': 0.0008228913369898379, 'weight_decay': 1.1741559136230854e-08, 'bspline_cap_quantile': 0.9928879969649733, 'bspline_positive_overflow': 'clip_to_cap'}. Best is trial 33 with value: 0.4722994188572313.
[I 2026-02-27 20:51:53,902] Trial 35 finished with value: 0.4758637011419634 and parameters: {'lr': 0.0005194647799703181, 'weight_decay': 2.7433773049054788e-08, 'bspline_cap_quantile': 0.9897931282731695, 'bspline_positive_overflow': 'large_token'}. Best is trial 33 with value: 0.4722994188572313.
[I 2026-02-27 21:01:54,702] Trial 36 finished with value: 0.47214535359248694 and parameters: {'lr': 0.001610537742805505, 'weight_decay': 2.783370325057684e-07, 'bspline_cap_quantile': 0.994433043107566, 'bspline_positive_overflow': 'clip_to_cap'}. Best is trial 36 with value: 0.47214535359248694.
[I 2026-02-27 21:11:46,028] Trial 37 finished with value: 0.4722299859537001 and parameters: {'lr': 0.0014632150217885904, 'weight_decay': 6.040893301063968e-08, 'bspline_cap_quantile': 0.9939543960175755, 'bspline_positive_overflow': 'clip_to_cap'}. Best is trial 36 with value: 0.47214535359248694.
[I 2026-02-27 21:21:25,946] Trial 38 finished with value: 0.4731564448172807 and parameters: {'lr': 0.0016789044824361225, 'weight_decay': 6.259218646232136e-08, 'bspline_cap_quantile': 0.9936344321294879, 'bspline_positive_overflow': 'large_token'}. Best is trial 36 with value: 0.47214535359248694.
[I 2026-02-27 21:28:37,085] Trial 39 finished with value: 0.47568708743823707 and parameters: {'lr': 0.0004025842482128957, 'weight_decay': 1.8976046048327838e-07, 'bspline_cap_quantile': 0.9940330427635723, 'bspline_positive_overflow': 'clip_to_cap'}. Best is trial 36 with value: 0.47214535359248694.
[I 2026-02-27 21:37:36,100] Trial 40 finished with value: 0.4900861737510151 and parameters: {'lr': 0.003066925713901653, 'weight_decay': 0.001906151469919467, 'bspline_cap_quantile': 0.9887463904579902, 'bspline_positive_overflow': 'large_token'}. Best is trial 36 with value: 0.47214535359248694.
[I 2026-02-27 21:46:51,390] Trial 41 finished with value: 0.47224162080159776 and parameters: {'lr': 0.0014586616520281784, 'weight_decay': 7.858199161618844e-08, 'bspline_cap_quantile': 0.9953293051844185, 'bspline_positive_overflow': 'clip_to_cap'}. Best is trial 36 with value: 0.47214535359248694.
[I 2026-02-27 21:54:09,482] Trial 42 finished with value: 0.4721720087743833 and parameters: {'lr': 0.0018836929731922655, 'weight_decay': 6.645858444375372e-08, 'bspline_cap_quantile': 0.9913297398064722, 'bspline_positive_overflow': 'clip_to_cap'}. Best is trial 36 with value: 0.47214535359248694.
[I 2026-02-27 22:01:08,760] Trial 43 finished with value: 0.47240257304694167 and parameters: {'lr': 0.0021034083520220454, 'weight_decay': 6.381868106628846e-07, 'bspline_cap_quantile': 0.9955203638651764, 'bspline_positive_overflow': 'clip_to_cap'}. Best is trial 36 with value: 0.47214535359248694.
[I 2026-02-27 22:08:06,753] Trial 44 finished with value: 0.47341407614638575 and parameters: {'lr': 0.0008245501970260623, 'weight_decay': 9.334336172211576e-08, 'bspline_cap_quantile': 0.9906699247325663, 'bspline_positive_overflow': 'clip_to_cap'}. Best is trial 36 with value: 0.47214535359248694.
[I 2026-02-27 22:15:30,710] Trial 45 finished with value: 0.4722158121802703 and parameters: {'lr': 0.0018059177132446454, 'weight_decay': 1.8195887160557898e-08, 'bspline_cap_quantile': 0.9947409070422097, 'bspline_positive_overflow': 'clip_to_cap'}. Best is trial 36 with value: 0.47214535359248694.
[I 2026-02-27 22:22:50,911] Trial 46 finished with value: 0.47317737781476477 and parameters: {'lr': 0.0017960408403508456, 'weight_decay': 2.2696644281184743e-08, 'bspline_cap_quantile': 0.9912587115286261, 'bspline_positive_overflow': 'large_token'}. Best is trial 36 with value: 0.47214535359248694.
[I 2026-02-27 22:29:49,235] Trial 47 finished with value: 0.4776447282199064 and parameters: {'lr': 0.004542934860825494, 'weight_decay': 5.615313779221487e-07, 'bspline_cap_quantile': 0.9955028884112839, 'bspline_positive_overflow': 'clip_to_cap'}. Best is trial 36 with value: 0.47214535359248694.
[I 2026-02-27 22:36:42,890] Trial 48 finished with value: 0.4722356577542735 and parameters: {'lr': 0.0020314236828484445, 'weight_decay': 8.222202087931111e-08, 'bspline_cap_quantile': 0.9870688238173296, 'bspline_positive_overflow': 'clip_to_cap'}. Best is trial 36 with value: 0.47214535359248694.
[I 2026-02-27 22:43:35,997] Trial 49 finished with value: 0.47477099406829454 and parameters: {'lr': 0.0034057532877544818, 'weight_decay': 2.0394473814633968e-07, 'bspline_cap_quantile': 0.9870891154476826, 'bspline_positive_overflow': 'clip_to_cap'}. Best is trial 36 with value: 0.47214535359248694.
[I 2026-02-27 22:50:35,986] Trial 50 finished with value: 0.4722526848825294 and parameters: {'lr': 0.0019668231299601515, 'weight_decay': 1.841872592498702e-08, 'bspline_cap_quantile': 0.9915012262729197, 'bspline_positive_overflow': 'clip_to_cap'}. Best is trial 36 with value: 0.47214535359248694.
[I 2026-02-27 22:57:40,485] Trial 51 finished with value: 0.4729513290008531 and parameters: {'lr': 0.0009606333570076206, 'weight_decay': 7.937339882667731e-08, 'bspline_cap_quantile': 0.9970799752026455, 'bspline_positive_overflow': 'clip_to_cap'}. Best is trial 36 with value: 0.47214535359248694.
[I 2026-02-27 23:02:32,538] Trial 52 finished with value: 0.47228180529983305 and parameters: {'lr': 0.0015129419790834615, 'weight_decay': 1.4282884092041664e-07, 'bspline_cap_quantile': 0.9865319574532573, 'bspline_positive_overflow': 'clip_to_cap'}. Best is trial 36 with value: 0.47214535359248694.
[I 2026-02-27 23:06:59,718] Trial 53 finished with value: 0.4722719138165338 and parameters: {'lr': 0.0020004265214795705, 'weight_decay': 6.918732869459678e-08, 'bspline_cap_quantile': 0.9920986363078822, 'bspline_positive_overflow': 'clip_to_cap'}. Best is trial 36 with value: 0.47214535359248694.
[I 2026-02-27 23:11:26,389] Trial 54 finished with value: 0.47283653953961385 and parameters: {'lr': 0.0009976961020691309, 'weight_decay': 3.6266458547301e-07, 'bspline_cap_quantile': 0.9951743666127405, 'bspline_positive_overflow': 'clip_to_cap'}. Best is trial 36 with value: 0.47214535359248694.
[I 2026-02-27 23:15:53,574] Trial 55 finished with value: 0.4739969407273284 and parameters: {'lr': 0.003117197572832408, 'weight_decay': 1.0387037403331941e-07, 'bspline_cap_quantile': 0.9891341963091537, 'bspline_positive_overflow': 'clip_to_cap'}. Best is trial 36 with value: 0.47214535359248694.
[I 2026-02-27 23:20:24,957] Trial 56 finished with value: 0.47225278948805016 and parameters: {'lr': 0.0016254174805699839, 'weight_decay': 1.1108656450883206e-06, 'bspline_cap_quantile': 0.9973726768683286, 'bspline_positive_overflow': 'clip_to_cap'}. Best is trial 36 with value: 0.47214535359248694.
[I 2026-02-27 23:24:55,314] Trial 57 finished with value: 0.5020724832774902 and parameters: {'lr': 0.00012239912546090453, 'weight_decay': 1.6595266746172558e-08, 'bspline_cap_quantile': 0.9989333442436996, 'bspline_positive_overflow': 'large_token'}. Best is trial 36 with value: 0.47214535359248694.
[I 2026-02-27 23:29:18,424] Trial 58 finished with value: 0.47322380991050056 and parameters: {'lr': 0.0027321994789067574, 'weight_decay': 5.857990157151609e-08, 'bspline_cap_quantile': 0.9946310400320135, 'bspline_positive_overflow': 'clip_to_cap'}. Best is trial 36 with value: 0.47214535359248694.
[I 2026-02-27 23:33:48,721] Trial 59 finished with value: 0.4724966009932272 and parameters: {'lr': 0.0022323376052426616, 'weight_decay': 1.6052376282142087e-07, 'bspline_cap_quantile': 0.9924317371564212, 'bspline_positive_overflow': 'clip_to_cap'}. Best is trial 36 with value: 0.47214535359248694.
[I 2026-02-27 23:38:17,709] Trial 60 finished with value: 0.4739968869739774 and parameters: {'lr': 0.000690769949511068, 'weight_decay': 4.5765622489602427e-07, 'bspline_cap_quantile': 0.9877724710712616, 'bspline_positive_overflow': 'clip_to_cap'}. Best is trial 36 with value: 0.47214535359248694.
[I 2026-02-27 23:42:40,448] Trial 61 finished with value: 0.47221391066859986 and parameters: {'lr': 0.001950795999067301, 'weight_decay': 1.8451314548675652e-08, 'bspline_cap_quantile': 0.990962889274356, 'bspline_positive_overflow': 'clip_to_cap'}. Best is trial 36 with value: 0.47214535359248694.
[I 2026-02-27 23:47:03,801] Trial 62 finished with value: 0.4722637550774051 and parameters: {'lr': 0.0014036730724257542, 'weight_decay': 4.62611133645309e-08, 'bspline_cap_quantile': 0.9896968168634467, 'bspline_positive_overflow': 'clip_to_cap'}. Best is trial 36 with value: 0.47214535359248694.
[I 2026-02-27 23:51:31,013] Trial 63 finished with value: 0.4721975938414413 and parameters: {'lr': 0.0018891222205995345, 'weight_decay': 1.921998480785779e-08, 'bspline_cap_quantile': 0.9907966263375915, 'bspline_positive_overflow': 'clip_to_cap'}. Best is trial 36 with value: 0.47214535359248694.
[I 2026-02-27 23:55:54,281] Trial 64 finished with value: 0.4721748331320719 and parameters: {'lr': 0.0017865843419387541, 'weight_decay': 1.9165622453939104e-08, 'bspline_cap_quantile': 0.9852609293459581, 'bspline_positive_overflow': 'clip_to_cap'}. Best is trial 36 with value: 0.47214535359248694.
[I 2026-02-28 00:00:22,966] Trial 65 finished with value: 0.4727322013954845 and parameters: {'lr': 0.0010855189697554354, 'weight_decay': 1.7889930031469287e-08, 'bspline_cap_quantile': 0.9852925098621758, 'bspline_positive_overflow': 'clip_to_cap'}. Best is trial 36 with value: 0.47214535359248694.
[I 2026-02-28 00:04:54,165] Trial 66 finished with value: 0.47591305947141227 and parameters: {'lr': 0.0038199767592758623, 'weight_decay': 2.584367077069327e-08, 'bspline_cap_quantile': 0.9903831015568403, 'bspline_positive_overflow': 'clip_to_cap'}. Best is trial 36 with value: 0.47214535359248694.
[I 2026-02-28 00:09:24,301] Trial 67 finished with value: 0.47224356880490415 and parameters: {'lr': 0.0018082357571265243, 'weight_decay': 1.0375469729128146e-08, 'bspline_cap_quantile': 0.978174694777345, 'bspline_positive_overflow': 'clip_to_cap'}. Best is trial 36 with value: 0.47214535359248694.
[I 2026-02-28 00:13:55,533] Trial 68 finished with value: 0.47261863386407377 and parameters: {'lr': 0.0023133120406720812, 'weight_decay': 3.9507930135911475e-08, 'bspline_cap_quantile': 0.9916701543315015, 'bspline_positive_overflow': 'clip_to_cap'}. Best is trial 36 with value: 0.47214535359248694.
